nct_id,brief_title,search_condition,conditions,sponsor,sponsor_class,enrollment_count,num_arms,total_sites,num_countries,start_date,completion_date,has_participant_flow,total_started,total_completed,total_discontinued,dropout_rate,discontinuation_reasons,top_dropout_reason,top_dropout_reason_count,num_periods
NCT01876368,Efficacy and Safety of LCZ696 Compared to Olmesartan in Essential Hypertensive Patients Not Responsive to Olmesartan,cardiovascular disease,Hypertension,Novartis Pharmaceuticals,INDUSTRY,376,2,51,7,2013-09,2014-08,True,376,354,22,5.9,Adverse Event (7); Protocol deviation (6); Subject/guardian decision (4); Physician Decision (2); Lack of Efficacy (1); Lost to Follow-up (1); Non-compliance with study treatment (1),Adverse Event,7.0,1
NCT00097591,A Comparison of Prasugrel (CS-747) and Clopidogrel in Acute Coronary Syndrome Subjects Who Are to Undergo Percutaneous Coronary Intervention,cardiovascular disease,Coronary Arteriosclerosis; Acute Coronary Syndromes,Eli Lilly and Company,INDUSTRY,13619,2,1,1,2004-11,2007-07,True,13608,12804,804,5.9,Withdrawal of consent (665); Unable to attend termination visit (104); Less than 6 months on study drug (16); Lost to follow up (16); Other (3),Withdrawal of consent,665.0,1
NCT04880850,"A Research Study to Compare Two Types of Insulin, a New Weekly Insulin, Insulin Icodec and an Available Daily Insulin, Insulin Glargine, Both in Combination With Mealtime Insulin, in People With Type 2 Diabetes Who Use Daily Insulin and Mealtime Insulin (ONWARDS 4)",diabetes type 2,"Diabetes Mellitus, Type 2",Novo Nordisk A/S,INDUSTRY,582,2,116,9,2021-05-14,2022-06-16,True,582,548,34,5.8,Withdrawal by Subject (19); Lost to Follow-up (9); Death (3); Physician Decision (3),Withdrawal by Subject,19.0,1
NCT01357616,Fixed Combination Brinzolamide 1%/Timolol 0.5% Versus Brinzolamide 1% + Timolol 0.5% in Open-Angle Glaucoma or Ocular Hypertension,hypertension,Open-Angle Glaucoma; Ocular Hypertension,Alcon Research,INDUSTRY,328,2,0,0,2010-11,2013-01,True,328,309,19,5.8,Lost to Follow-up (7); Decision Unrelated to Adverse Event (4); Inadequate Control of IOP (3); Adverse Event (2); Protocol Violation (2); Withdrawal by Subject (1),Lost to Follow-up,7.0,1
NCT01513590,A Trial Comparing Efficacy and Safety of Insulin Degludec/Insulin Aspart and BIAsp 30 in Insulin naïve Subjects With Type 2 Diabetes,diabetes type 2,"Diabetes; Diabetes Mellitus, Type 2",Novo Nordisk A/S,INDUSTRY,394,2,49,10,2012-01-16,2012-11-19,True,394,371,23,5.8,Unclassified (15); Adverse Event (5); Withdrawal Criteria (3),Unclassified,15.0,1
NCT00980174,Study to Compare the Efficacy and Safety of DenosumAb Versus Placebo in Males With Osteoporosis,metabolic syndrome,Low Bone Mass; Low Bone Mineral Density; Males With Osteoporosis; Osteopenia; Osteoporosis,Amgen,INDUSTRY,242,2,0,0,2009-10-01,2012-05-23,True,242,228,14,5.8,Withdrawal by Subject (5); Adverse Event (3); Ineligibility determined (3); Death (2); Other (1),Withdrawal by Subject,5.0,1
NCT01786993,MultiPoint Pacing IDE Study,cardiovascular disease,Heart Failure,Abbott Medical Devices,INDUSTRY,506,2,49,1,2013-04,2016-06,True,381,359,22,5.8,Death (13); Withdrawal by Subject (5); Lost to Follow-up (1); Subject Non-Compliance (1); System Explant (1); Hospice Admission (1),Death,13.0,1
NCT01722604,Therapeutic Equivalence Study of Generic Brinzolamide vs Azopt,hypertension,Glaucoma; Open Angle or Ocular Hypertension,Bausch & Lomb Incorporated,INDUSTRY,258,2,1,1,2012-01,2012-09,True,258,243,0,5.8,,,,1
NCT02774265,A Different Approach to Preventing Thrombosis,cardiovascular disease,Venous Thromboembolism; Pulmonary Embolism,"University of Maryland, Baltimore",OTHER,329,2,1,1,2016-01,2017-09,True,329,310,0,5.8,,,,1
NCT00141778,"Renin-angiotensin-aldosterone System (RAAS), Inflammation, and Post-Operative Atrial Fibrillation (AF)",cardiovascular disease,Atrial Fibrillation,Vanderbilt University,OTHER,455,3,1,1,2005-04,2010-08,True,458,432,26,5.7,Withdrawal by Subject (15); Met safety criteria for discontinuation (9); Difficulty Swallowing (1); Chest Discomfort (1),Withdrawal by Subject,15.0,2
NCT02607865,Efficacy and Long-term Safety of Oral Semaglutide Versus Sitagliptin in Subjects With Type 2 Diabetes,diabetes type 2,"Diabetes; Diabetes Mellitus, Type 2",Novo Nordisk A/S,INDUSTRY,1864,4,242,15,2016-02-15,2018-03-28,True,1864,1758,106,5.7,Withdrawal by Subject (61); Lost to Follow-up (28); Death (13); Unclassified (4),Withdrawal by Subject,61.0,1
NCT03548935,STEP 1: Research Study Investigating How Well Semaglutide Works in People Suffering From Overweight or Obesity,obesity,Metabolism and Nutrition Disorder; Overweight or Obesity,Novo Nordisk A/S,INDUSTRY,1961,2,128,17,2018-06-04,2021-03-05,True,1961,1849,112,5.7,Lost to Follow-up (67); Withdrawal by Subject (43); Death (2),Lost to Follow-up,67.0,1
NCT01763918,Reduction of LDL-C With PCSK9 Inhibition in Heterozygous Familial Hypercholesterolemia Disorder Study-2,dyslipidemia,Hyperlipidemia,Amgen,INDUSTRY,331,4,39,14,2013-02-07,2013-12-19,True,331,312,19,5.7,Sponsor Decision (13); Withdrawal by Subject (6),Sponsor Decision,13.0,1
NCT02648217,"Comparing Efficacy and Safety of Insulin Degludec/Insulin Aspart Twice Daily and Biphasic Insulin Aspart Twice Daily in Subjects With Type 2 Diabetes Mellitus Before, During and After Ramadan",diabetes type 2,"Diabetes; Diabetes Mellitus, Type 2",Novo Nordisk A/S,INDUSTRY,263,2,32,6,2016-01-04,2016-09-05,True,263,248,15,5.7,Withdrawal by Subject (7); Unclassified (5); Lost to Follow-up (2); Adverse Event (1),Withdrawal by Subject,7.0,1
NCT02906930,Efficacy and Safety of Oral Semaglutide Versus Placebo in Subjects With Type 2 Diabetes Mellitus Treated With Diet and Exercise Only,diabetes type 2,"Diabetes; Diabetes Mellitus, Type 2",Novo Nordisk A/S,INDUSTRY,703,4,105,11,2016-09-20,2017-12-08,True,703,663,40,5.7,Lost to Follow-up (19); Withdrawal by Subject (14); Other (6); Death (1),Lost to Follow-up,19.0,1
NCT02371759,Lidocaine + Clonidine for Intraoral Anesthesia in Patients With Diabetes Mellitus Type 2,diabetes type 2,Diabetes Mellitus; Local Anesthesia,University of Belgrade,OTHER,256,8,1,1,2013-06,2016-01,True,233,220,13,5.6,Protocol Violation (12); Withdrawal by Subject (1),Protocol Violation,12.0,1
NCT00918879,Evaluate Saxagliptin in Adult Indian Patients With Type 2 Diabetes Inadequate Glycemic Control,diabetes type 2,Type 2 Diabetes,AstraZeneca,INDUSTRY,213,2,9,1,2009-05,2010-07,True,213,201,12,5.6,Withdrawal by Subject (8); Lost to Follow-up (2); Severe non-compliance to protocol (2),Withdrawal by Subject,8.0,1
NCT01047501,Effect of AMR101 (Ethyl Icosapentate) on Triglyceride (Tg) Levels in Patients on Statins With High Tg Levels (≥ 200 and < 500 mg/dL),dyslipidemia,Hypertriglyceridemia,Amarin Pharma Inc.,INDUSTRY,702,3,80,1,2009-12,2011-02,True,702,663,39,5.6,Adverse Event (20); Withdrew Consent (12); Lost to Follow-up (2); Other discontinuation (2); Triglycerides >800 mg/dL (1); Death (1); Investigator judgement (1),Adverse Event,20.0,1
NCT04074161,Research Study to Investigate How Well Semaglutide Works Compared to Liraglutide in People Living With Overweight or Obesity,obesity,Overweight; Obesity,Novo Nordisk A/S,INDUSTRY,338,4,19,1,2019-09-11,2021-05-11,True,338,319,19,5.6,Lost to Follow-up (12); Withdrawal by Subject (7),Lost to Follow-up,12.0,1
NCT00600483,Safety and Efficacy of an Antibiotic Implant in Cardiac Surgical Subjects at Higher Risk for Sternal Wound Infection,obesity,Cardiac Surgery; Sternal Wound Infection,Innocoll,INDUSTRY,1502,2,43,1,2007-12,2010-09,True,1502,1419,83,5.5,Lost to Follow-up (73); Randomized but not treated (10),Lost to Follow-up,73.0,1
NCT01763905,Goal Achievement After Utilizing an Anti-PCSK9 Antibody in Statin Intolerant Subjects -2,dyslipidemia,Hyperlipidemia,Amgen,INDUSTRY,307,4,58,14,2013-01-24,2013-11-19,True,307,290,17,5.5,Decision by sponsor (13); Withdrawal by Subject (3); Lost to Follow-up (1),Decision by sponsor,13.0,1
NCT00445003,Laser-Ranibizumab-Triamcinolone for Proliferative Diabetic Retinopathy,cardiovascular disease,Proliferative Diabetic Retinopathy; Diabetic Macular Edema,Jaeb Center for Health Research,OTHER,333,3,56,1,2007-03,2010-07,True,345,326,19,5.5,Missed Visit (9); Dropped (6); Death (4),Missed Visit,9.0,1
NCT01516879,Durable Effect of PCSK9 Antibody CompARed wiTh placEbo Study,dyslipidemia,Hypercholesterolemia,Amgen,INDUSTRY,905,2,96,9,2012-01-05,2013-10-14,True,905,855,50,5.5,Withdrawal by Subject (20); Other (15); Lost to Follow-up (13); Death (2),Withdrawal by Subject,20.0,1
NCT04986202,Study to Evaluate the Efficacy and Safety of AZD4831 in Participants With Heart Failure With Left Ventricular Ejection Fraction > 40%,cardiovascular disease,Heart Failure With Preserved Ejection Fraction,AstraZeneca,INDUSTRY,711,5,171,18,2021-06-30,2024-03-27,True,711,672,39,5.5,Death (23); Withdrawal by Subject (10); Physician Decision (6),Death,23.0,1
NCT00790205,Sitagliptin Cardiovascular Outcomes Study (MK-0431-082),diabetes type 2,Type 2 Diabetes Mellitus,Merck Sharp & Dohme LLC,INDUSTRY,14671,2,0,0,2008-12-10,2015-03-30,True,14671,13877,794,5.4,Withdrawal by Subject (662); Lost to Follow-up (132),Withdrawal by Subject,662.0,1
NCT01853072,Nepafenac Once Daily for Macular Edema - Study 1,diabetes type 2,Non-Proliferative Diabetic Retinopathy; Cataract,Alcon Research,INDUSTRY,881,2,0,0,2013-06,2015-05,True,615,582,33,5.4,Reason not specified (15); Death (5); Adverse Event (3); Lost to Follow-up (3); Withdrawal by Subject (3); Physician Decision (2); Adverse event prior to treatment (1); Non-compliance with study drug (1),Reason not specified,15.0,1
NCT02666664,Evaluation of Long-Term Safety and Tolerability of ETC-1002 in High-Risk Patients With Hyperlipidemia and High CV Risk (CLEAR Harmony),cardiovascular disease,Hypercholesterolemia; Atherosclerotic Cardiovascular Diseases,"Esperion Therapeutics, Inc.",INDUSTRY,2230,2,104,6,2016-01-21,2018-03-28,True,2230,2110,120,5.4,Withdrawal by participant (63); Adverse Event (49); Lost to Follow-up (3); Protocol Violation (2); Physician Decision (1); Other (1); Sponsor decision (1),Withdrawal by participant,63.0,1
NCT03175120,A Trial Comparing Insulin Degludec/Liraglutide and Insulin Degludec in Combination With Metformin in Chinese Subjects With Type 2 Diabetes Mellitus Inadequately Controlled With Basal Insulin Therapy and Metformin With or Without One Other Oral Antidiabetic Drug (OAD),diabetes type 2,"Diabetes; Diabetes Mellitus, Type 2",Novo Nordisk A/S,INDUSTRY,453,2,37,2,2017-05-26,2019-04-04,True,453,429,24,5.3,Protocol Violation (7); Withdrawal by Subject (7); Other (5); Adverse Event (4); Lost to Follow-up (1),Protocol Violation,7.0,1
NCT00411554,A Study of Sitagliptin in Patients With Type 2 Diabetes Mellitus Who Have Inadequate Glycemic Control on Diet/Exercise Therapy (0431-054)(COMPLETED),diabetes type 2,"Diabetes Mellitus, Non-Insulin-Dependent",Merck Sharp & Dohme LLC,INDUSTRY,319,2,0,0,2007-01,2007-08,True,319,302,17,5.3,Lack of Efficacy (7); Adverse Event (6); Withdrawal by Subject (3); Patient Moved (1),Lack of Efficacy,7.0,1
NCT05352815,"A Research Study to See How Well the New Weekly Medicine IcoSema, Which is a Combination of Insulin Icodec and Semaglutide, Controls Blood Sugar Level in People With Type 2 Diabetes Compared to Weekly Insulin Icodec",diabetes type 2,"Diabetes Mellitus, Type 2",Novo Nordisk A/S,INDUSTRY,1291,2,281,22,2022-06-01,2024-04-23,True,1291,1222,69,5.3,Withdrawal by Subject (52); Lost to Follow-up (11); Death (5); Site closure (1),Withdrawal by Subject,52.0,1
NCT00486018,A Study of the Efficacy and Safety of Ranibizumab Injection in Patients With Macular Edema Secondary to Branch Retinal Vein Occlusion (BRAVO),cardiovascular disease,Macular Edema; Retinal Vein Occlusion,"Genentech, Inc.",INDUSTRY,397,3,0,0,2007-07,2009-11,True,397,376,0,5.3,,,,1
NCT02897349,Linagliptin Add-on to Insulin Background Therapy,diabetes type 2,"Diabetes Mellitus, Type 2",Boehringer Ingelheim,INDUSTRY,206,2,25,1,2016-09-30,2019-01-18,True,206,195,11,5.3,Adverse Event (6); Lost to Follow-up (4); Other than listed above (1),Adverse Event,6.0,1
NCT00643201,Efficacy and Safety Study of Apixaban for the Treatment of Deep Vein Thrombosis or Pulmonary Embolism,cardiovascular disease,Venous Thrombosis,Bristol-Myers Squibb,INDUSTRY,5614,2,381,31,2008-07,2013-03,True,5395,5107,939,5.3,Adverse Event (332); Other (214); Withdrawal by Subject (150); Death (108); Lost to Follow-up (62); Poor or non-compliance (43); Fails to meet inclusion/exclusion (22); Pregnancy (5); Administrative reason (2); non-specified (1),Adverse Event,332.0,2
NCT05142722,Randomized Study to Evaluate the Effect of Obicetrapib on Top of Maximum Tolerated Lipid-Modifying Therapies,cardiovascular disease,Dyslipidemias; High Cholesterol; Hypercholesterolemia; Familial Hypercholesterolemia; Atherosclerotic Cardiovascular Disease,NewAmsterdam Pharma,INDUSTRY,2530,2,181,8,2021-12-15,2024-09-26,True,2530,2395,135,5.3,Lost to Follow-up (54); Withdrawal by Subject (47); Death (28); Adverse Event (3); Participant Moved Away (2); Physician Decision (1),Lost to Follow-up,54.0,1
NCT05362058,A Study of Insulin Efsitora Alfa (LY3209590) Compared to Degludec in Adults With Type 2 Diabetes Who Are Starting Basal Insulin for the First Time,diabetes type 2,Diabetes; Type 2 Diabetes,Eli Lilly and Company,INDUSTRY,928,2,113,11,2022-06-03,2024-04-10,True,928,880,57,5.2,Withdrawal by Subject (24); Lost to Follow-up (12); Assigned treatment by mistake (7); Adverse Event (6); Death (3); Protocol deviation (3); Non-compliance with study drug (1); Physician Decision (1),Withdrawal by Subject,24.0,2
NCT00002850,Antibiotic Therapy in Preventing Early Infection in Patients With Multiple Myeloma Who Are Receiving Chemotherapy,cardiovascular disease,Infection; Multiple Myeloma,Gary Morrow,OTHER,212,3,45,3,1997-03,2012-01,True,212,201,11,5.2,Death (8); Protocol Violation (2); Withdrawal by Subject (1),Death,8.0,1
NCT00777946,Study to Evaluate the Efficacy and Safety of Combination Aliskiren/Amlodipine in Patients Not Adequately Responding to Aliskiren Alone,cardiovascular disease,Hypertension,Novartis,INDUSTRY,818,3,9,9,2008-10,2009-05,True,820,777,43,5.2,Adverse Event (15); Lack of Efficacy (9); Patient withdrew consent (8); Lost to Follow-up (4); Protocol deviation (4); Randomized in error (2); Condition no longer required study drug (1),Adverse Event,15.0,1
NCT00249249,Study to Compare the Efficacy of Pitavastatin With That of Atorvastatin in Lowering Cholesterol Levels,dyslipidemia,Primary Hypercholesterolemia; Dyslipidemia,Kowa Research Europe,INDUSTRY,830,0,192,13,2005-10,2006-11,True,830,787,0,5.2,,,,1
NCT02185417,Diuretic Comparison Project,cardiovascular disease,Hypertension,VA Office of Research and Development,FED,20723,3,70,2,2016-06-15,2022-12-29,True,17651,16738,913,5.2,Death (894); Withdrawal by Subject (19),Death,894.0,1
NCT01894568,A Study Comparing Insulin Peglispro With Insulin Glargine as Basal Insulin Treatment,diabetes type 2,Type 2 Diabetes Mellitus,Eli Lilly and Company,INDUSTRY,388,2,31,3,2013-07,2015-04,True,388,368,20,5.2,Withdrawal by Subject (10); Adverse Event (5); Protocol required discontinuation (3); Physician Decision (1); Lost to Follow-up (1),Withdrawal by Subject,10.0,1
NCT02988115,Evaluation of the Efficacy and Safety of Bempedoic Acid (ETC-1002) in Patients With Hyperlipidemia and Statin Intolerant,cardiovascular disease,Hypercholesterolemia; Atherosclerotic Cardiovascular Disease; Statin Adverse Reaction,"Esperion Therapeutics, Inc.",INDUSTRY,345,2,67,2,2016-11-16,2018-03-16,True,345,327,18,5.2,Adverse Event (7); Sponsor Decision (7); Withdrawal by Subject (2); Withdrawn by Mistake (1); Lost to Follow-up (1),Adverse Event,7.0,1
NCT04591626,A Study of Dulaglutide (LY2189265) in Chinese Participants With Type 2 Diabetes,diabetes type 2,Type 2 Diabetes Mellitus,Eli Lilly and Company,INDUSTRY,291,2,27,1,2020-12-07,2022-04-28,True,291,276,15,5.2,Withdrawal by Subject (8); Adverse Event (4); Physician Decision (1); Death (1); Non-Compliance with Study Drug (1),Withdrawal by Subject,8.0,1
NCT01895777,Open Label Study Comparing Efficacy and Safety of Dabigatran Etexilate to Standard of Care in Paediatric Patients With Venous Thromboembolism (VTE),cardiovascular disease,Venous Thromboembolism,Boehringer Ingelheim,INDUSTRY,267,2,65,26,2013-09-25,2019-11-14,True,267,253,14,5.2,Other reasons (5); Adverse Event (3); Non-compliance with the CTP (3); Lost to Follow-up (2); Not treated (1),Other reasons,5.0,1
NCT04039503,A Study of Tirzepatide (LY3298176) Versus Placebo in Participants With Type 2 Diabetes Inadequately Controlled on Insulin Glargine With or Without Metformin,diabetes type 2,Type 2 Diabetes,Eli Lilly and Company,INDUSTRY,475,4,48,8,2019-08-30,2021-01-13,True,475,451,24,5.1,Withdrawal by Subject (14); Adverse Event (5); Protocol Violation (4); Lost to Follow-up (1),Withdrawal by Subject,14.0,1
NCT01930188,Efficacy and Safety of Semaglutide Once-weekly Versus Sitagliptin Once-daily as add-on to Metformin and/or TZD in Subjects With Type 2 Diabetes,diabetes type 2,"Diabetes; Diabetes Mellitus, Type 2",Novo Nordisk A/S,INDUSTRY,1231,4,141,18,2013-12-02,2015-10-12,True,1225,1163,62,5.1,Withdrawal by Subject (28); unclassified (12); Lost to Follow-up (9); Missing follow-up information (7); Death (6),Withdrawal by Subject,28.0,1
NCT02738879,Randomized Sitagliptin Withdrawal Study (MK-0431-845),diabetes type 2,Type 2 Diabetes Mellitus,Merck Sharp & Dohme LLC,INDUSTRY,746,2,0,0,2016-05-09,2018-01-30,True,746,708,38,5.1,Withdrawal by Subject (12); Physician Decision (7); Lost to Follow-up (6); Protocol Violation (4); Screen Failure (3); Adverse Event (2); Death (2); Pregnancy (1); Site Discontinued Study Participation (1),Withdrawal by Subject,12.0,1
NCT03987919,A Study of Tirzepatide (LY3298176) Versus Semaglutide Once Weekly as Add-on Therapy to Metformin in Participants With Type 2 Diabetes,diabetes type 2,Type 2 Diabetes,Eli Lilly and Company,INDUSTRY,1879,4,127,9,2019-07-30,2021-02-15,True,1879,1783,96,5.1,Lost to Follow-up (31); Withdrawal by Subject (26); Death (13); Adverse Event (9); Physician Decision (6); Other - as reported by the investigator (6); Pregnancy (3); Protocol Violation (1); Site terminated by Sponsor (1),Lost to Follow-up,31.0,1
NCT01697592,Omarigliptin (MK-3102) Clinical Trial - Add-on to Oral Antihyperglycemic Agent Study in Japanese Participants With Type 2 Diabetes Mellitus (MK-3102-015),diabetes type 2,Type 2 Diabetes Mellitus,Merck Sharp & Dohme LLC,INDUSTRY,585,10,0,0,2012-10-24,2014-05-08,True,585,555,30,5.1,Adverse Event (17); Withdrawal by Subject (8); Physician Decision (3); Lost to Follow-up (1); Protocol Violation (1),Adverse Event,17.0,2
NCT01499953,Superficial Vein Thrombosis (SVT) Treated With Rivaroxaban Versus Fondaparinux,cardiovascular disease,Superficial Vein Thrombosis,GWT-TUD GmbH,OTHER,472,2,23,1,2012-04,2016-05,True,472,448,0,5.1,,,,1
NCT05425745,Evaluate the Effect of Obicetrapib in Patients With HeFH on Top of Maximum Tolerated Lipid-Modifying Therapies.,dyslipidemia,"Dyslipidemias; High Cholesterol; Hypercholesterolemia; Familial Hypercholesterolemia; Lipid Metabolism Disorder; Metabolic Disease; Lipid Metabolism, Inborn Errors; Genetic Disease, Inborn; Hyperlipoproteinemias",NewAmsterdam Pharma,INDUSTRY,354,2,96,10,2022-07-25,2024-05-28,True,354,336,18,5.1,Withdrawal of Consent (6); Death (5); Lost to Follow-up (3); Adverse Event (1); Did not return for end of study visit (1); End of study visit completed by phone (1); Subject decision (1),Withdrawal of Consent,6.0,1
NCT02836873,Safety and Efficacy of Bexagliflozin in Type 2 Diabetes Mellitus Patients With Moderate Renal Impairment,diabetes type 2,Type 2 Diabetes Mellitus,Theracos,INDUSTRY,312,2,56,4,2016-09-23,2018-01-11,True,312,296,16,5.1,Adverse Event (5); Withdrawal by Subject (4); Lost to Follow-up (4); Protocol Violation (1); Physician Decision (1); Other (1),Adverse Event,5.0,1
NCT02630706,A Study to Evaluate the Efficacy and Safety of Ertugliflozin in Asian Participants With Type 2 Diabetes and Inadequate Glycemic Control on Metformin Monotherapy (MK-8835-012),diabetes type 2,Type 2 Diabetes Mellitus,Merck Sharp & Dohme LLC,INDUSTRY,506,3,0,0,2015-12-16,2017-12-27,True,506,480,26,5.1,Withdrawal by Subject (16); Adverse Event (4); Lost to Follow-up (3); Physician Decision (2); Pregnancy (1),Withdrawal by Subject,16.0,1
NCT01422304,Reversal of Neuromuscular Blockade With Sugammadex or Usual Care in Hip Fracture Surgery or Joint (Hip/Knee) Replacement (P07038),cardiovascular disease,"Neuromuscular Blockade; Arthroplasty, Replacement, Hip; Arthroplasty, Replacement, Knee; Blood Coagulation; Antithrombotic Agents",Merck Sharp & Dohme LLC,INDUSTRY,1198,2,0,0,2011-10-12,2012-09-26,True,1198,1137,61,5.1,Lost to Follow-up (34); Not Treated (14); Withdrawal by Subject (6); Never Entered Follow-up (3); Did Not Meet Protocol Eligibility (2); Adverse Event (1); Protocol Violation (1),Lost to Follow-up,34.0,1
NCT02991118,Evaluation of Long-Term Efficacy of Bempedoic Acid (ETC-1002) in Patients With Hyperlipidemia at High Cardiovascular Risk,cardiovascular disease,Hypercholesterolemia; Atherosclerotic Cardiovascular Disease,"Esperion Therapeutics, Inc.",INDUSTRY,779,2,2,1,2016-11-18,2018-08-22,True,779,740,39,5.0,Death (11); Lost to Follow-up (10); Withdrawal by Subject (8); Adverse Event (4); Protocol Violation (3); Physician Decision (1); Moved out of the country (1); Could not attend study visits (1),Death,11.0,1
NCT01618669,A Study to Assess Regadenoson Administration Following an Inadequate Exercise Stress Test as Compared to Regadenoson Alone for Myocardial Perfusion Imaging (MPI) Using Single Photon Emission Computed Tomography (SPECT),cardiovascular disease,Coronary Artery Disease (CAD),"Astellas Pharma Global Development, Inc.",INDUSTRY,1147,2,69,4,2012-06,2014-12,True,1147,1090,57,5.0,Adverse Event (23); Withdrawal by Subject (18); Protocol Violation (8); Randomized but Never Received Study Drug (5); Lost to Follow-up (2); Miscellaneous Reason (1),Adverse Event,23.0,1
NCT03337308,"A Study Evaluating the Safety and Efficacy of Bempedoic Acid Plus Ezetimibe Fixed-Dose Combination Compared to Bempedoic Acid, Ezetimibe, and Placebo in Patients Treated With Maximally Tolerated Statin Therapy",cardiovascular disease,Hyperlipidemias,"Esperion Therapeutics, Inc.",INDUSTRY,382,4,5,1,2017-10-23,2018-07-18,True,382,363,19,5.0,Adverse Event (9); Withdrawal by Subject (6); Lost to Follow-up (3); Protocol Violation (1),Adverse Event,9.0,1
NCT03444324,Adjusted Fibrinogen Replacement Strategy,cardiovascular disease,Bleeding Disorder; Hypofibrinogenemia; Acquired,Biotest,INDUSTRY,222,2,19,7,2018-04-03,2023-11-21,True,222,211,11,5.0,Lost to Follow-up (6); Lack of Trial Compliance (2); Withdrawal by Subject (1); Protocol Violation (1); Physical disability to come to the site for the closing visit (1),Lost to Follow-up,6.0,1
NCT03961360,Effectiveness of Higher Aspirin Dosing for Prevention of Preeclampsia in High Risk Obese Gravida,cardiovascular disease,Pre-Eclampsia; Hypertension in Pregnancy; Obesity,"The University of Texas Health Science Center, Houston",OTHER,220,2,1,1,2019-05-06,2023-04-10,True,220,209,0,5.0,,,,1
NCT04445519,Phase 3 Trial of NCX 470 vs. Latanoprost in Subjects With Open-Angle Glaucoma or Ocular Hypertension,hypertension,Open Angle Glaucoma; Ocular Hypertension,"Nicox Ophthalmics, Inc.",INDUSTRY,691,5,1,1,2020-06-01,2022-09-16,True,691,657,34,4.9,Adverse Event (14); Withdrawal by Subject (6); Lost to Follow-up (5); Due to adaptive design (3); Sponsor or IRB Decision (3); Other Reason (2); Protocol Violation (1),Adverse Event,14.0,1
NCT02512042,Bioequivalence Study With Clinical Endpoint Comparing Brinzolamide 1% Ophthalmic Suspension to Azopt® 1% Ophthalmic Suspension In the Treatment of Chronic Open Angle Glaucoma or Ocular Hypertension in Both Eyes,hypertension,Glaucoma,Actavis Inc.,INDUSTRY,973,2,10,1,2015-04,2016-05,True,973,925,48,4.9,Other (22); Withdrawal by Subject (12); Lost to Follow-up (7); Adverse Event (4); Non-compliance with study drug (3),Other,22.0,1
NCT00449956,MK0507A Clinical Study in Patients With Glaucoma and Ocular Hypertension (0507A-149)(COMPLETED),hypertension,Glaucoma,Merck Sharp & Dohme LLC,INDUSTRY,474,3,0,0,2007-03-12,2008-02-16,True,474,451,23,4.9,Adverse Event (14); Physician Decision (4); Protocol Violation (3); Lack of Efficacy (1); Withdrawal by Subject (1),Adverse Event,14.0,1
NCT01302691,MK-0954E Study in Participants With Hypertension (MK-0954E-357),cardiovascular disease,Hypertension,Merck Sharp & Dohme LLC,INDUSTRY,327,2,0,0,2011-01-01,2012-04-01,True,327,311,16,4.9,Blood Pressure/Potassium Criteria Met (10); Adverse Event (2); Death (1); Lost to Follow-up (1); Physician Decision (1); Protocol Violation (1),Blood Pressure/Potassium Criteria Met,10.0,1
NCT00998881,Monotherapy Study of MP-513 in Patients With Type 2 Diabetes,diabetes type 2,Type 2 Diabetes Mellitus,Tanabe Pharma Corporation,INDUSTRY,203,2,1,1,2009-09,2010-06,True,203,193,10,4.9,Adverse Event (4); Physician Decision (3); Lack of Efficacy (1); Withdrawal by Subject (1); Personal matter (1),Adverse Event,4.0,1
NCT03351478,Efficacy and Safety of Sotagliflozin Versus Placebo and Empagliflozin in Participants With Type 2 Diabetes Mellitus Who Have Inadequate Glycemic Control While Taking a DPP4 Inhibitor Alone or With Metformin,diabetes type 2,Type 2 Diabetes Mellitus,Lexicon Pharmaceuticals,INDUSTRY,770,3,160,12,2017-11-27,2019-05-16,True,770,732,38,4.9,At the subject's own request (28); Adverse Event (4); Reason not Specified (4); Poor compliance to protocol (1); Lost to Follow-up (1),At the subject's own request,28.0,1
