nct_id,brief_title,search_condition,conditions,sponsor,sponsor_class,enrollment_count,num_arms,total_sites,num_countries,start_date,completion_date,has_participant_flow,total_started,total_completed,total_discontinued,dropout_rate,discontinuation_reasons,top_dropout_reason,top_dropout_reason_count,num_periods
NCT02681094,"A Multi-Center, Randomized, Double-Blind, Phase III Trial to Evaluate the Safety and Efficacy of Saxagliptin Co-administered With Dapagliflozin Compared to Saxagliptin or Dapagliflozin All Given as add-on Therapy to Metformin in Subject With Type 2 Diabetes",diabetes type 2,Type 2 Diabetes Mellitus; Inadequate Glycaemic Control,AstraZeneca,INDUSTRY,905,3,110,6,2016-02-26,2017-07-15,True,883,770,264,12.8,Participant decision (52); Study specific discontinuation criteria (50); Study-specific discontinuation criteria (44); Lack of therapeutic response (40); Other (38); Adverse Event (30); Severe non-compliance to protocol (6); No treatment given (4),Participant decision,52.0,2
NCT01068665,Comparison of NN1250 With Insulin Glargine in Subjects With Type 2 Diabetes,diabetes type 2,"Diabetes; Diabetes Mellitus, Type 2",Novo Nordisk A/S,INDUSTRY,460,2,116,8,2010-03,2010-11,True,460,401,59,12.8,Other (29); Withdrawal Criteria (12); Adverse Event (9); Protocol Violation (7); Lack of Efficacy (2),Other,29.0,1
NCT01421459,A Study in Adults With Type 2 Diabetes,diabetes type 2,"Diabetes Mellitus, Type 2",Eli Lilly and Company,INDUSTRY,759,2,62,12,2011-09,2012-09,True,759,662,97,12.8,Withdrawal by Subject (28); Physician Decision (18); Lost to Follow-up (17); Adverse Event (16); Protocol Violation (13); Lack of Efficacy (3); Death (2),Withdrawal by Subject,28.0,1
NCT01164501,Efficacy and Safety of Empagliflozin (BI 10773) in Patients With Type 2 Diabetes and Renal Impairment,diabetes type 2,"Diabetes Mellitus, Type 2; Renal Insufficiency",Boehringer Ingelheim,INDUSTRY,741,3,127,15,2010-07,2012-07,True,741,646,95,12.8,"Adverse Event (43); Patient refusal to continue,not due toAE (22); Other reason not defined above (14); Non compliant with protocol (6); Lost to Follow-up (6); Not treated (3); Lack of Efficacy (1)",Adverse Event,43.0,1
NCT02033889,A Study To Evaluate The Efficacy And Safety Of Ertugliflozin In Participants With Type 2 Diabetes Mellitus And Inadequate Glycemic Control On Metformin Monotherapy (MK-8835-007).,diabetes type 2,Type 2 Diabetes Mellitus,Merck Sharp & Dohme LLC,INDUSTRY,621,3,0,0,2013-12-13,2017-08-03,True,621,542,79,12.7,Withdrawal by Subject (41); Lost to Follow-up (19); Adverse Event (7); Death (6); Excluded Medication (2); Physician Decision (2); Non-Compliance With Study Drug (1); Participant moved (1),Withdrawal by Subject,41.0,1
NCT00437645,Efficacy and Safety of Valsartan/Amlodipine Compared to Amlodipine in Patients With Essential Hypertension,cardiovascular disease,Essential Hypertension,Novartis Pharmaceuticals,INDUSTRY,1183,2,12,12,2007-01,2007-11,True,1183,1033,150,12.7,Adverse Event (99); Withdrawal by Subject (32); Protocol Violation (6); Lost to Follow-up (5); Administrative problems (3); Lack of Efficacy (3); Condition no longer requires study drug (2),Adverse Event,99.0,1
NCT00558259,Twice-daily Oral Direct Thrombin Inhibitor Dabigatran Etexilate in the Long Term Prevention of Recurrent Symptomatic VTE,cardiovascular disease,Venous Thromboembolism,Boehringer Ingelheim,INDUSTRY,1353,2,147,21,2007-11,,True,1343,1173,170,12.7,Adverse Event (131); Withdrawal by Subject (25); Protocol Violation (14),Adverse Event,131.0,1
NCT01095653,A Phase III Study of BMS-512148 (Dapagliflozin) in Asian Patients With Type 2 Diabetes Who Are Not Well Controlled With Diet and Exercise,diabetes type 2,Type 2 Diabetes,AstraZeneca,INDUSTRY,1179,3,39,4,2010-06,2012-03,True,393,343,50,12.7,"non-compliance, not met criteria, etc. (21); Withdrawal by Subject (12); Adverse Event (9); Lost to Follow-up (5); Lack of Efficacy (3)","non-compliance, not met criteria, etc.",21.0,1
NCT00256867,A Study In Patients With Type 2 Diabetes Mellitus,diabetes type 2,"Diabetes Mellitus, Type 2",GlaxoSmithKline,INDUSTRY,369,0,85,6,2005-08-18,2006-10-31,True,369,322,47,12.7,Lost to Follow-up (14); Adverse Event (12); Withdrawal by Subject (11); Protocol Violation (3); Fasting plasma glucose >240 mg/dL (1); Glycemia over 13.3 millimole per litre (1); Investigator's Decision (1); Non-compliance with study medication (1); Participant travelled Overseas (1); Participant out of assessment window (1); Withdrawal by participant (1),Lost to Follow-up,14.0,1
NCT00489541,TAXUS PERSEUS Small Vessel,cardiovascular disease,Coronary Artery Disease,Boston Scientific Corporation,INDUSTRY,224,1,28,1,2007-07,2013-10,True,349,305,58,12.6,No 9-Month Angiography Performed (35); Not Evaluable for 9-Month Angiography (9); Withdrawal by Subject (5); Death (5); Lost to Follow-up (2); Missed 12-Month Visit (2),No 9-Month Angiography Performed,35.0,2
NCT00667719,A Long Term Safety Study to Test the Combination of Aliskiren/ Amlodipine / Hydrochlorothiazide in Participants With Essential Hypertension,cardiovascular disease,Essential Hypertension,Novartis,INDUSTRY,564,1,8,8,2008-06-05,2009-10-05,True,564,493,71,12.6,Adverse Event (39); Withdrawal by Subject (17); Lost to Follow-up (8); Unsatisfactory Therapeutic Effect (3); Protocol Violation (3); Abnormal Test Procedure (1),Adverse Event,39.0,1
NCT04252287,"A Study on Impact of Canagliflozin on Health Status, Quality of Life, and Functional Status in Heart Failure",cardiovascular disease,Heart Failure,"Janssen Research & Development, LLC",INDUSTRY,476,2,18,1,2020-03-10,2021-11-09,True,476,416,60,12.6,Withdrawal by Subject (35); Lost to Follow-up (10); Death (8); Protocol Violation (7),Withdrawal by Subject,35.0,1
NCT00683878,Add-on to Thiazolidinedione (TZD) Failures,diabetes type 2,Type 2 Diabetes,AstraZeneca,INDUSTRY,972,3,89,9,2008-07,2010-06,True,420,367,53,12.6,"Withdrawal by Subject (23); Adverse Event (10); Lost to Follow-up (10); Non-compliance, not met criteria etc. (5); Lack of Efficacy (4); Death (1)",Withdrawal by Subject,23.0,1
NCT00846365,Efficacy and Safety of Azilsartan Medoxomil Plus Chlorthalidone in Participants With Moderate to Severe Hypertension,cardiovascular disease,Essential Hypertension,Takeda,INDUSTRY,1085,3,80,3,2009-03,2010-06,True,1085,948,137,12.6,Adverse Event (61); Withdrawal by Subject (31); Other (16); Lost to Follow-up (15); Protocol Violation (9); Lack of Efficacy (4); Pregnancy (1),Adverse Event,61.0,1
NCT01151410,"An Extension Study to Evaluate the Long Term Safety, Tolerability and Efficacy of Aliskiren Compared to Enalapril in Pediatric Hypertensive Patients 6-17 Years of Age",cardiovascular disease,Hypertension,Novartis Pharmaceuticals,INDUSTRY,208,2,36,7,2010-08,2015-08,True,208,182,26,12.5,Withdrawal by Subject (8); Lost to Follow-up (7); Adverse Event (3); Protocol deviation (3); Administrative problems (2); Unsatisfactory therapeutic effect (2); Abnormal laboratory value(s) (1),Withdrawal by Subject,8.0,1
NCT01059812,A Pan Asian Trial Comparing Efficacy and Safety of NN5401 and Biphasic Insulin Aspart 30 in Type 2 Diabetes,diabetes type 2,"Diabetes; Diabetes Mellitus, Type 2",Novo Nordisk A/S,INDUSTRY,424,2,46,5,2010-02-01,2010-12-23,True,424,371,53,12.5,Unclassified (18); Adverse Event (14); Withdrawal Criteria (13); Lack of Efficacy (4); Protocol Violation (4),Unclassified,18.0,1
NCT01031680,"Efficacy and Safety in Patients With Type 2 Diabetes Mellitus, Cardiovascular Disease and Hypertension",diabetes type 2,Type 2 Diabetes Mellitus; Cardiovascular Disease; Hypertension; Inadequate Glycaemic Control,AstraZeneca,INDUSTRY,922,2,140,9,2010-02,2012-12,True,922,807,115,12.5,Subject No Longer Meets Study Criteria (43); Withdrawal by Subject (28); Lost to Follow-up (12); Adverse Event (11); Poor/Non-compliance (11); Death (3); Incorrect Enrolment (3); Various (2); Safety (1); Administrative Reason by Sponsor (1),Subject No Longer Meets Study Criteria,43.0,1
NCT00463606,A Multicenter Study Comparing the Safety and Efficacy of ABT-335 and Rosuvastatin Calcium Combination Therapy to Monotherapy in Subjects With Dyslipidemia,dyslipidemia,Hypercholesterolemia; Dyslipidemia,AstraZeneca,INDUSTRY,760,3,168,1,2007-04,2008-02,True,758,663,95,12.5,Adverse Event (50); Withdrawal by Subject (27); Lost to Follow-up (7); Subject noncompliance (2); Exclusion criteria violation (2); Subject moved out of town (1); Physician Decision (1); Sponsor request (1); Coordinator error (1); Patient randomized in error (1); Participation in another ABT-335 trial (1); Protocol Violation (1),Adverse Event,50.0,1
NCT02314637,Long-term Safety Study of MP-513 as Monotherapy or in Combination With Sulfonylurea in Japanese Type 2 Diabetic Patients,diabetes type 2,Type 2 Diabetes Mellitus,Tanabe Pharma Corporation,INDUSTRY,240,2,1,1,2009-08,2011-07,True,240,210,30,12.5,Adverse Event (12); Withdrawal by Subject (9); Physician Decision (7); Lack of Efficacy (1); Other Reason (1),Adverse Event,12.0,1
NCT02227875,Non-inferiority Study to Compare the Efficacy and Safety of Mylan's Insulin Glargine With Lantus® in Type 2 Diabetes Mellitus Patients (INSTRIDE 2),diabetes type 2,Type 2 Diabetes,Mylan Inc.,INDUSTRY,560,2,120,6,2014-08,2015-12,True,560,490,70,12.5,Withdrawal by Subject (25); Lost to Follow-up (20); Protocol Violation (17); Other (4); Adverse Event (3); Physician Decision (1),Withdrawal by Subject,25.0,1
NCT01986881,"Cardiovascular Outcomes Following Ertugliflozin Treatment in Type 2 Diabetes Mellitus Participants With Vascular Disease, The VERTIS CV Study (MK-8835-004)",diabetes type 2,Type 2 Diabetes Mellitus,Merck Sharp & Dohme LLC,INDUSTRY,8246,3,0,0,2013-11-04,2019-12-27,True,8246,7212,1034,12.5,Death (708); Lost to Follow-up (150); Withdrawal by Subject (146); Physician Decision (17); Study Site Terminated by Sponsor (7); Other (5); Subject Moved (1),Death,708.0,1
NCT00888355,MK0954 Versus Placebo for Treatment of Mild to Moderate Hypertension,cardiovascular disease,Hypertension,Merck Sharp & Dohme LLC,INDUSTRY,428,4,0,0,1992-05,1993-02,True,428,375,53,12.4,Lack of Efficacy (18); Adverse Event (16); Protocol Violation (8); Withdrawal by Subject (7); Lost to Follow-up (4),Lack of Efficacy,18.0,1
NCT03952143,A Study of LY900014 Compared to Insulin Lispro (Humalog) in Adults With Type 2 Diabetes,diabetes type 2,Type 2 Diabetes Mellitus,Eli Lilly and Company,INDUSTRY,628,2,41,3,2019-05-27,2021-01-20,True,628,550,78,12.4,Withdrawal by Subject (50); Physician Decision (7); Due to COVID 19 restrictions (7); Protocol Violation (6); Adverse Event (3); Lack of Efficacy (2); Lost to Follow-up (2); Participant had taken prohibited concomitant medication (1),Withdrawal by Subject,50.0,2
NCT01026194,Efficacy and Safety Study of MP-513 in Combination With Thiazolidinedione in Patients With Type 2 Diabetes,diabetes type 2,Type 2 Diabetes Mellitus,Tanabe Pharma Corporation,INDUSTRY,204,2,1,1,2009-12,2011-06,True,204,179,25,12.3,Adverse Event (12); Physician Decision (8); Withdrawal by Subject (4); Lack of Efficacy (1),Adverse Event,12.0,2
NCT00546754,BP-EASE -Effectiveness of Losartan 50 mg/Hydrochlorothiazide (HCTZ) 12.5 mg Versus Valsartan 80 mg/HCTZ 12.5 mg Titrated as Needed in Patients With Essential Hypertension Not Controlled on Monotherapy (0954A-333),cardiovascular disease,Hypertension,Organon and Co,INDUSTRY,808,2,0,0,2007-05-01,2009-05-01,True,808,709,99,12.3,"Adverse Event (27); Lost to Follow-up (24); Missing (21); Withdrawal by Subject (13); Protocol Violation (3); Serious Adverse Event (2); Lack of Efficacy (2); Dyspnea (1); Per Data Query, Less Than 4 Wks Coversyl (1); Hip Replacement (1); Suicide (1); Missing Cooperation (1); Elevated Creatinine and Potassium levels (1); Patient's Decision (1)",Adverse Event,27.0,1
NCT00143507,The BEAUTIFUL Study: Effects of Ivabradine in Patients With Stable Coronary Artery Disease and Left Ventricular Systolic Dysfunction,cardiovascular disease,"Coronary Disease; Ventricular Dysfunction, Left",Institut de Recherches Internationales Servier,OTHER,10917,2,1,1,2004-12,2008-02,True,10917,9578,1339,12.3,Death (1119); Withdrawal by Subject (216); Withdrawn by sponsor's decision (3); Lost to Follow-up (1),Death,1119.0,1
NCT01885559,HALT Progression of Polycystic Kidney Disease Study B,cardiovascular disease,"Kidney, Polycystic",National Institute of Diabetes and Digestive and Kidney Diseases (NIDDK),NIH,486,2,7,1,2006-01,2014-06,True,486,426,60,12.3,Lost to Follow-up (31); Less than full participation (28); Protocol Violation (1),Lost to Follow-up,31.0,1
NCT01646320,Safety and Efficacy of Dapagliflozin in Triple Therapy to Treat Subjects With Type 2 Diabetes,diabetes type 2,Type 2 Diabetes,AstraZeneca,INDUSTRY,320,2,66,8,2012-09,2015-02,True,320,281,32,12.2,Lost to Follow-up (10); Adverse Event (9); Not reported (4); Withdrawal by Subject (4); Subject no longer meets study criteria (2); No longer meets study criteria (1); Other (1); Lack of Efficacy (1),Lost to Follow-up,10.0,2
NCT02447172,Study of a Topical Gentamicin-Collagen Sponge Along With Systemic Antibiotic in Infected Diabetic Foot Ulcers,cardiovascular disease,"Foot Ulcer, Diabetic; Infection",Innocoll,INDUSTRY,524,3,91,16,2015-06,2016-09,True,524,460,64,12.2,Adverse Event (26); Lost to Follow-up (15); Withdrawal by Subject (9); Protocol Violation (5); protocol specific treatment unrelated (5); Death (4),Adverse Event,26.0,1
NCT01064687,A Study in Participants With Type 2 Diabetes Mellitus,diabetes type 2,"Diabetes Mellitus, Type 2",Eli Lilly and Company,INDUSTRY,978,4,89,4,2010-02,2012-05,True,978,860,118,12.1,Lost to Follow-up (35); Withdrawal by Subject (33); Adverse Event (26); Lack of Efficacy (6); Physician Decision (4); Entry Criteria Not Met (3); Protocol Violation (3); Sponsor Decision (3); Treatment Noncompliance (3); Death (2),Lost to Follow-up,35.0,1
NCT01128153,Saxagliptin Triple Oral Therapy,diabetes type 2,Type 2 Diabetes,AstraZeneca,INDUSTRY,257,2,33,6,2010-06,2011-06,True,257,226,31,12.1,Condition under investigation worsened (15); Withdrawal by Subject (5); Adverse Event (4); Incorrect enrolment to study (3); Protocol Violation (2); Developed discontinuation criteria (2),Condition under investigation worsened,15.0,1
NCT00661362,Evaluate Efficacy and Safety of Saxagliptin in Combination With Metformin in Adult Patients With Type 2 Diabetes,diabetes type 2,Type 2 Diabetes,AstraZeneca,INDUSTRY,570,2,30,3,2008-06,2009-09,True,570,501,69,12.1,Withdrawal by Subject (36); Study specific discontinuation criteria (15); Adverse Event (9); Lost to Follow-up (4); Incorrect enrollment (2); Severe non-compliance to protocol (1); Safety reasons (1); Metformin dose haven't decreasd to 2.5 g (1),Withdrawal by Subject,36.0,1
NCT00168818,Dabigatran Etexilate in Extended Venous Thromboembolism (VTE) Prevention After Hip Replacement Surgery,cardiovascular disease,"Thromboembolism; Arthroplasty, Replacement, Hip",Boehringer Ingelheim,INDUSTRY,3494,3,116,16,2004-11,,True,3463,3046,767,12.0,Adverse Event (317); Withdrawal by Subject (188); Other (159); Protocol Violation (68); Lost to Follow-up (35),Adverse Event,317.0,2
NCT00395343,Sitagliptin Added-on to Insulin Study (0431-051),diabetes type 2,Type 2 Diabetes Mellitus,Merck Sharp & Dohme LLC,INDUSTRY,641,2,0,0,2006-12-11,2008-10-13,True,641,564,77,12.0,Withdrawal by Subject (23); Adverse Event (18); Protocol Violation (14); Lost to Follow-up (8); Other (7); Physician Decision (6); Lack of Efficacy (1),Withdrawal by Subject,23.0,1
NCT00687882,Evaluation of the Duration of Therapy for Thrombosis in Children,cardiovascular disease,Venous Thrombosis,Johns Hopkins All Children's Hospital,OTHER,532,4,63,6,2008-03,2022-02-15,True,532,468,0,12.0,,,,1
NCT00591253,Efficacy and Safety of Azilsartan Medoxomil in African American Participants With Essential Hypertension,cardiovascular disease,Hypertension,Takeda,INDUSTRY,413,3,64,2,2007-10,2009-04,True,415,365,50,12.0,Withdrawal by Subject (14); Other (13); Adverse Event (7); Protocol Violation (6); Lost to Follow-up (6); Lack of Efficacy (4),Withdrawal by Subject,14.0,1
NCT02476006,"Safety, Tolerability, and Effect of Alirocumab in High Cardiovascular Risk Patients With Severe Hypercholesterolemia Not Adequately Controlled With Conventional Lipid-modifying Therapies (ODYSSEY APPRISE)",cardiovascular disease,Hypercholesterolemia,Sanofi,INDUSTRY,998,1,153,16,2015-06-23,2019-04-12,True,998,878,120,12.0,Adverse Event (41); Participant did not wish to continue (39); Sponsor decision (6); Lost to Follow-up (5); Physician Decision (5); Death (4); Study ended treatment not available (4); Switched to commercial drug (4); Enrolled but not treated (4); Poor compliance to study protocol (3); Lack of treatment efficacy (2); Pregnancy (1); Excluded from study (1); Protocol Violation (1),Adverse Event,41.0,1
NCT01819129,Efficacy and Safety of FIAsp Compared to Insulin Aspart in Combination With Insulin Glargine and Metformin in Adults With Type 2 Diabetes,diabetes type 2,"Diabetes; Diabetes Mellitus, Type 2",Novo Nordisk A/S,INDUSTRY,881,2,144,10,2013-09-09,2015-01-22,True,689,606,83,12.0,"Withdrawal Criteria (35); Withdrawal by Subject (30); Lost to Follow-up (7); Adverse Event (5); Death (2); Other, Subject wanted HbA1c to be > 7% (1); Other, weight gain, hypoglycaemic events (1); Other, Subject moved out of the country (1); Lack of Efficacy (1)",Withdrawal Criteria,35.0,1
NCT01798706,Efficacy and Safety of Lixisenatide Versus Placebo on Top of Basal Insulin and/or Oral Antidiabetic Treatment in Older Type 2 Diabetic Patients,diabetes type 2,Type 2 Diabetes,Sanofi,INDUSTRY,350,2,83,13,2013-06,2015-02,True,350,308,42,12.0,Adverse Event (25); Other than specified above (14); Lack of Efficacy (2); Poor compliance to protocol (1),Adverse Event,25.0,1
NCT00000620,Action to Control Cardiovascular Risk in Diabetes (ACCORD),diabetes type 2,"Atherosclerosis; Cardiovascular Diseases; Hypercholesterolemia; Hypertension; Diabetes Mellitus, Type 2; Diabetes Mellitus; Coronary Disease","National Heart, Lung, and Blood Institute (NHLBI)",NIH,10251,6,7,2,1999-09,2012-12,True,10251,9023,1228,12.0,Death (718); Withdrawal by Subject (237); missed closeout visit (160); Lost to Follow-up (113),Death,718.0,1
NCT01422876,Efficacy and Safety of Empagliflozin (BI 10773) / Linagliptin (BI 1356) Fixed Dose Combination in Treatment naïve and Metformin Treated Type 2 Diabetes Patients,diabetes type 2,"Diabetes Mellitus, Type 2",Boehringer Ingelheim,INDUSTRY,1405,5,211,22,2011-08,2013-09,True,1363,1201,226,11.9,Consent withdrawn (136); Lost to Follow-up (82); Death (8),Consent withdrawn,136.0,2
NCT01396057,Efficacy and Safety of Ranibizumab Intravitreal Injections Versus Dexamethasone Intravitreal Implant in Patients With Branch Retinal Vein Occlusion (BRVO),cardiovascular disease,Visual Impairment; Macular Edema; Branch Retinal Vein Occlusion,Novartis Pharmaceuticals,INDUSTRY,244,2,66,5,2011-07,2013-06,True,244,215,29,11.9,Adverse Event (8); Unsatisfactory therapeutic effect (8); Protocol deviation (8); Consent withdrawn (5),Adverse Event,8.0,1
NCT00402363,"Evaluation of Efficacy and Safety of Lovaza (Omega-3-Acid Ethyl Esters) in Recurrent, Symptomatic Atrial Fibrillation",cardiovascular disease,"Fibrillation, Atrial",GlaxoSmithKline,INDUSTRY,663,2,178,1,2006-11,2010-01,True,663,584,79,11.9,"Adverse Event (27); Withdrew Consent (18); Captured as ""Other"" (12); Protocol Violation (11); Lost to Follow-up (11)",Adverse Event,27.0,1
NCT00654381,Japanese P III vs Voglibose and Placebo,diabetes type 2,"Diabetes Mellitus, Type 2",Boehringer Ingelheim,INDUSTRY,561,4,47,1,2008-04,,True,561,494,67,11.9,Adverse Event (52); Withdrawal by Subject (8); Investigator's decision (3); Closure of the trial site (2); Protocol Violation (1); Lack of Efficacy (1),Adverse Event,52.0,3
NCT02809131,Perioperative Antibiotic Therapy to Prevent Cardiac Implantable Electronic Device Infections.,cardiovascular disease,Sick Sinus Syndrome; Complete Heart Block; Syncope; Chronic Systolic Heart Failure,Vanderbilt University Medical Center,OTHER,1010,2,1,1,2016-04-01,2021-09-30,True,1010,890,0,11.9,,,,1
NCT00529451,"Safety and Efficacy of Aliskiren 300 mg, 150 mg and 75 mg in Patients With Essential Hypertension Compared to Ramipril 5 mg",cardiovascular disease,Hypertension,Novartis,INDUSTRY,1613,4,3,3,2007-09,2008-07,True,1316,1160,156,11.9,Subject withdrew consent (62); Adverse Event (47); Lost to Follow-up (19); Unsatisfactory therapeutic response (17); Protocol deviation (7); Administrative problems (4),Subject withdrew consent,62.0,1
NCT02865850,Efficacy and Safety Study to Evaluate Vadadustat for the Correction or Maintenance Treatment of Anemia in Participants With Incident Dialysis-dependent Chronic Kidney Disease (DD-CKD),cardiovascular disease,Anemia; Dialysis-Dependent Chronic Kidney Disease,Akebia Therapeutics,INDUSTRY,369,2,118,11,2016-07,2020-03-30,True,369,325,44,11.9,Death (34); Withdrawal by Subject (5); Lost to Follow-up (5),Death,34.0,1
NCT00673231,"Efficacy and Safety of Dapagliflozin, Added to Therapy of Patients With Type 2 Diabetes With Inadequate Glycemic Control on Insulin",diabetes type 2,Type 2 Diabetes,AstraZeneca,INDUSTRY,1240,4,92,13,2008-04,2011-01,True,807,712,95,11.8,"Withdrawal by Subject (38); Adverse Event (26); Study criteria,compliance,safety, other (24); Lost to Follow-up (6); Death (1)",Withdrawal by Subject,38.0,1
NCT01318135,Long-term Safety Study of Alogliptin Used in Combination With Sulfonylurea or Metformin in Participants With Type 2 Diabetes in Japan,diabetes type 2,Type 2 Diabetes Mellitus,Takeda,INDUSTRY,576,4,0,0,2009-01,2010-04,True,576,508,64,11.8,Adverse Event (26); Lack of Efficacy (23); Withdrawal by Subject (10); Protocol Violation (3); Treatment Complications (1); Use of Excluded Medications (1),Adverse Event,26.0,2
NCT01703221,Omarigliptin (MK-3102) Clinical Trial - Placebo- and Sitagliptin-Controlled Monotherapy Study in Japanese Patients With Type 2 Diabetes Mellitus (MK-3102-020),diabetes type 2,Type 2 Diabetes Mellitus,Merck Sharp & Dohme LLC,INDUSTRY,414,3,0,0,2012-10-24,2014-04-25,True,414,365,49,11.8,Lack of Efficacy (28); Adverse Event (13); Withdrawal by Subject (6); Physician Decision (1); Protocol Violation (1),Lack of Efficacy,28.0,2
NCT00887250,A Study to Investigate the Antihypertensive Efficacy of MK0954,cardiovascular disease,Hypertension,Merck Sharp & Dohme LLC,INDUSTRY,366,3,0,0,1991-12,1992-11,True,366,323,43,11.7,Lack of Efficacy (16); Adverse Event (10); Lost to Follow-up (6); Protocol Violation (5); Withdrawal by Subject (5); Patient uncooperative (1),Lack of Efficacy,16.0,1
NCT00781391,Global Study to Assess the Safety and Effectiveness of Edoxaban (DU-176b) vs Standard Practice of Dosing With Warfarin in Patients With Atrial Fibrillation,cardiovascular disease,Stroke; Atrial Fibrillation; Embolism,Daiichi Sankyo,INDUSTRY,21105,3,1009,46,2008-11,2013-05,True,21105,18635,2470,11.7,Death (2225); Withdrawal by Subject (109); never received study drug (79); Protocol Violation (56); Lost to Follow-up (1),Death,2225.0,1
NCT02273050,Evaluate the Efficacy and Safety of Saxagliptin in Combination With Metformin IR Compared to Saxagliptin Monotherapy and to Metformin IR Monotherapy in Drug Naive Chinese Subjects With Type 2 Diabetes Who Have Inadequate Glycaemic Control,diabetes type 2,Type 2 Diabetes Mellitus,AstraZeneca,INDUSTRY,1136,3,17,1,2014-12,2016-08,True,640,565,75,11.7,Withdrawal by Subject (47); Adverse Event (10); Protocol Violation (8); Lost to Follow-up (5); Dev. of study spec. withdrawal criteria (2); Lack of Efficacy (2); Death (1),Withdrawal by Subject,47.0,1
NCT03211858,Comparison of SAR341402 to NovoLog/NovoRapid in Adult Patients With Diabetes Mellitus Also Using Insulin Glargine,diabetes type 2,Type 1 Diabetes Mellitus-Type 2 Diabetes Mellitus,Sanofi,INDUSTRY,597,2,82,7,2017-08-02,2019-01-12,True,597,527,70,11.7,Other than specified above (43); Adverse Event (14); Poor compliance to protocol (8); Lack of Efficacy (4); Non-serious Hypoglycemia (1),Other than specified above,43.0,1
NCT00286741,Can Group Visits Improve Outcomes of Veterans With Diabetes,cardiovascular disease,Diabetes; Hypertension,US Department of Veterans Affairs,FED,239,2,2,1,2006-06,2009-01,True,239,211,0,11.7,,,,1
NCT00960076,An 18 Week Efficacy and Safety Study of Saxagliptin and Metformin XR Combination in Subjects With Type 2 Diabetes,diabetes type 2,Type 2 Diabetes,AstraZeneca,INDUSTRY,282,2,35,5,2009-08,2010-10,True,282,249,33,11.7,Adverse Event (8); No longer met study criteria (6); Lost to Follow-up (6); Hyperglycemia (6); Withdrawal by Subject (3); Severe non-compliance to protocol (3); Did not attend the termination visit (1),Adverse Event,8.0,1
NCT01968954,Randomized Clinical Trial Of Bococizumab (PF-04950615; RN316) In Subjects With Hyperlipidemia Or Mixed Dyslipidemia At Risk Of Cardiovascular Events,cardiovascular disease,Hyperlipidemia,Pfizer,INDUSTRY,711,2,103,9,2013-10,2016-04,True,711,628,83,11.7,Withdrawal by Subject (43); Other (15); Lost to Follow-up (10); Adverse Event (9); Death (3); Did not met inclusion criteria (2); Protocol Violation (1),Withdrawal by Subject,43.0,1
NCT01590771,A Study in China Evaluating the Safety and Efficacy of Adding Sitagliptin to Stable Therapy With Sulfonylurea With or Without Metformin in Participants With Type 2 Diabetes Mellitus (T2DM) (MK-0431-253),diabetes type 2,Type 2 Diabetes Mellitus,Merck Sharp & Dohme LLC,INDUSTRY,498,2,0,0,2012-07-09,2014-06-24,True,498,440,58,11.6,Withdrawal by Subject (23); Other Protocol Specified Criteria (19); Adverse Event (10); Protocol Violation (3); Lost to Follow-up (2); Lack of Efficacy (1),Withdrawal by Subject,23.0,1
