nct_id,brief_title,search_condition,conditions,sponsor,sponsor_class,enrollment_count,num_arms,total_sites,num_countries,start_date,completion_date,has_participant_flow,total_started,total_completed,total_discontinued,dropout_rate,discontinuation_reasons,top_dropout_reason,top_dropout_reason_count,num_periods
NCT00168298,A Study of the Safety and Efficacy of a New Treatment for Macular Edema Resulting From Retinal Vein Occlusion,cardiovascular disease,Macular Edema; Retinal Vein Occlusion,Allergan,INDUSTRY,668,3,13,13,2004-11-01,2008-09-05,True,668,500,0,25.1,,,,2
NCT00604383,Protein Kinase C (PKC) Inhibitor-Diabetic Retinopathy Phase 3 Study,diabetes type 2,Diabetic Retinopathy,"Chromaderm, Inc.",INDUSTRY,685,2,1,1,2001-03,2005-06,True,685,514,171,25.0,Withdrawal by Subject (64); Lost to Follow-up (43); Death (36); Adverse Event (25); Physician Decision (3),Withdrawal by Subject,64.0,1
NCT00712673,"GLP-1 Receptor Agonist Lixisenatide (Morning or Evening) in Patients With Type 2 Diabetes for Glycemic Control and Safety Evaluation, on Top of Metformin",diabetes type 2,"Diabetes Mellitus, Type 2",Sanofi,INDUSTRY,680,4,16,16,2008-06,2011-03,True,680,511,169,24.9,Adverse Event (53); Withdrawal by Subject (48); Poor Compliance to Protocol (26); Lack of Efficacy (24); Familial and Personal Reasons (12); Lost to Follow-up (3); Protocol Violation (2); Investigator's Decision (1),Adverse Event,53.0,1
NCT02849080,Efficacy and Safety of Oral Semaglutide Using a Flexible Dose Adjustment Based on Clinical Evaluation Versus Sitagliptin in Subjects With Type 2 Diabetes Mellitus.,diabetes type 2,"Diabetes; Diabetes Mellitus, Type 2",Novo Nordisk A/S,INDUSTRY,504,2,83,10,2016-09-20,2019-03-27,True,504,379,23,24.8,Lost to Follow-up (13); Withdrawal by Subject (7); Death (2); Other (1),Lost to Follow-up,13.0,2
NCT01620489,Efficacy and Safety of Liraglutide Versus Placebo as add-on to Existing Diabetes Medication in Subjects With Type 2 Diabetes and Moderate Renal Impairment,diabetes type 2,"Diabetes; Diabetes Mellitus, Type 2",Novo Nordisk A/S,INDUSTRY,279,2,97,6,2012-06-14,2013-08-20,True,279,210,69,24.7,Withdrawal Criteria (42); Adverse Event (21); Protocol Violation (3); Unclassified (3),Withdrawal Criteria,42.0,1
NCT01830543,A Study Exploring Two Strategies of Rivaroxaban (JNJ39039039; BAY-59-7939) and One of Oral Vitamin K Antagonist in Patients With Atrial Fibrillation Who Undergo Percutaneous Coronary Intervention,cardiovascular disease,Atrial Fibrillation; Percutaneous Coronary Intervention,"Janssen Scientific Affairs, LLC",INDUSTRY,2124,3,348,25,2013-05-10,2016-07-28,True,2124,1599,525,24.7,Adverse Event (244); Subject Decision (97); Other (66); Death (64); Physician Decision (28); Protocol Violation (17); Withdrawal by consent (9),Adverse Event,244.0,1
NCT00368277,"A Safety and Efficacy Trial of Aliskiren 150mg , 300 mg Compared to Ramipril 5mg, 10mg in the Elderly",cardiovascular disease,Hypertension,Novartis Pharmaceuticals,INDUSTRY,901,2,1,1,2006-09,2008-02,True,901,680,221,24.5,Adverse Event (82); Patient withdrew consent (60); Unsatisfactory therapeutic effect (55); Lost to Follow-up (14); Protocol deviation (7); Death (3),Adverse Event,82.0,1
NCT00624923,Targeting Inflammation Using Salsalate in CardioVascular Disease,cardiovascular disease,Coronary Artery Disease; Overweight,Joslin Diabetes Center,OTHER,340,2,5,1,2008-09,2016-07,True,251,190,0,24.3,,,,1
NCT00202878,IMPROVE-IT: Examining Outcomes in Subjects With Acute Coronary Syndrome: Vytorin (Ezetimibe/Simvastatin) vs Simvastatin (P04103),cardiovascular disease,Hypercholesterolemia; Myocardial Infarction,Organon and Co,INDUSTRY,18144,2,0,0,2005-10-17,2014-09-18,True,18144,13728,4416,24.3,Death (1932); Withdrawal by Subject (1603); Only Vital Status Known (713); Lost to Follow-up (93); Site Closure (75),Death,1932.0,1
NCT00283686,HALT Progression of Polycystic Kidney Disease Study A,cardiovascular disease,"Kidney, Polycystic",National Institute of Diabetes and Digestive and Kidney Diseases (NIDDK),NIH,558,4,7,1,2006-01,2014-06,True,558,423,135,24.2,Lost to Follow-up (98); Less than full participation (34); Death (3),Lost to Follow-up,98.0,1
NCT01999218,Ertugliflozin vs. Glimepiride in Type 2 Diabetes Mellitus (T2DM) Participants on Metformin (MK-8835-002),diabetes type 2,Type 2 Diabetes Mellitus,Merck Sharp & Dohme LLC,INDUSTRY,1326,3,0,0,2013-12-16,2017-04-18,True,1326,1006,320,24.1,Withdrawal by Subject (91); Lost to Follow-up (57); Hyperglycemia (52); Study Terminated By Sponsor (24); Adverse Event (23); Protocol Violation (13); Non-Compliance With Study Drug (11); Physician Decision (11); Participant moves (10); Death (10); Treated but excluded at 1 trial site (10); Excluded Medication (4); Lack of Efficacy (2); Screen failure (1); Creatinine/eGFR (1),Withdrawal by Subject,91.0,1
NCT00571649,Venous Thromboembolic Event (VTE) Prophylaxis in Medically Ill Patients,cardiovascular disease,Venous Thromboembolism,Bayer,INDUSTRY,8101,2,676,53,2007-12,2010-11,True,8101,6145,3169,24.1,Adverse Event (909); Withdrawal by Subject (774); Death (400); Patient convenience (281); Lost to Follow-up (271); Protocol Violation (199); Non-compliant with study medication (177); Clinical endpoint reached (113); Physician Decision (37); Technical problems (8),Adverse Event,909.0,2
NCT00457002,Study of Apixaban for the Prevention of Thrombosis-related Events in Patients With Acute Medical Illness,cardiovascular disease,Venous Thrombosis; Pulmonary Embolism,Bristol-Myers Squibb,INDUSTRY,6758,2,296,35,2007-06,2011-05,True,6528,4958,1570,24.1,Withdrawal by Subject (570); Adverse Event (544); Lost to Follow-up (143); Death (87); Poor/Non-compliance (79); No longer met criteria (78); non-specified (67); Administrative reason by Sponsor (1); treated for 1 day; missing status/reason (1),Withdrawal by Subject,570.0,1
NCT01098539,A Study of the Efficacy and Safety of Albiglutide in Subjects With Type 2 Diabetes With Renal Impairment.,diabetes type 2,"Diabetes Mellitus, Type 2",GlaxoSmithKline,INDUSTRY,507,2,218,15,2010-05,2012-11,True,495,376,119,24.0,Adverse Event (52); Withdrawal by Subject (38); Noncompliance (8); Lost to Follow-up (8); Physician Decision (8); Protocol Violation (5),Adverse Event,52.0,1
NCT00827606,Atorvastatin Three Year Pediatric Study,dyslipidemia,Familial Hypercholesterolemia,Pfizer's Upjohn has merged with Mylan to form Viatris Inc.,INDUSTRY,272,1,40,15,2009-03,2013-10,True,271,206,65,24.0,Other (18); LDL below 2.59 mmol/L (16); Withdrawal by Subject (13); Protocol Violation (7); Adverse Event (6); Lost to Follow-up (4); Pregnancy (1),Other,18.0,1
NCT01046110,Comparison of NN1250 With Sitagliptin in Subjects With Type 2 Diabetes Never Treated With Insulin,diabetes type 2,"Diabetes; Diabetes Mellitus, Type 2",Novo Nordisk A/S,INDUSTRY,458,2,93,7,2010-01,2010-11,True,458,348,110,24.0,Unclassified (71); Protocol Violation (19); Adverse Event (11); Withdrawal Criteria (8); Lack of Efficacy (1),Unclassified,71.0,1
NCT00094302,Aldosterone Antagonist Therapy for Adults With Heart Failure and Preserved Systolic Function,cardiovascular disease,"Cardiovascular Diseases; Heart Diseases; Heart Failure, Congestive",Carelon Research,OTHER,3445,2,270,6,2006-08,2013-06,True,3445,2622,823,23.9,Death (512); Withdrawal by Subject (214); Lost to Follow-up (84); Physician Decision (13),Death,512.0,1
NCT01396083,Efficacy and Safety of Ranibizumab Intravitreal Injections Versus Dexamethasone Intravitreal Implant in Patients With Central Retinal Vein Occlusion (CRVO),cardiovascular disease,Visual Impairment; Macular Edema; Central Retinal Vein Occlusion,Novartis Pharmaceuticals,INDUSTRY,243,2,64,4,2011-08,2014-01,True,243,185,58,23.9,Adverse Event (30); Unsatisfactory therapeutic effect (15); Consent withdrawn (9); Protocol deviation(s) (1); Abnormal laboratory value(s) (1); Administrative problems (1); Lost to Follow-up (1),Adverse Event,30.0,1
NCT02419612,"A 52-week International, Multicenter Trial With a Long -Term Extension to Evaluate Saxagliptin With Dapagliflozin in Combination With Metformin Compared to Glimepiride in Combination With Metformin in Type 2 Diabetes Who Have Inadequate Glycemic Control on Metformin Alone",diabetes type 2,Diabetes,AstraZeneca,INDUSTRY,444,2,84,10,2015-08-14,2019-09-18,True,444,338,84,23.9,Withdrawal by Subject (28); Lost to Follow-up (22); Other (8); Adverse Event (7); Subject Decision (6); Non-compliance with Study Drug (4); Death (3); Subject Request To Discontinue Treatment (2); Lack of Efficacy (2); Worsening of liver function (1); Subject moved out of state (1),Withdrawal by Subject,28.0,2
NCT03199053,Study to Evaluate Safety and Efficacy of Dapagliflozin and Saxagliptin in Patients With Type 2 Diabetes Mellitus (T2DM) Aged 10 to Below 18 Years Old,diabetes type 2,"Diabetes Mellitus, Type 2",AstraZeneca,INDUSTRY,256,5,122,23,2017-10-11,2024-01-03,True,245,187,53,23.7,Withdrawal by Subject (22); Lost to Follow-up (17); Withdrawal by parent/guardian (11); Miscellaneous (3),Withdrawal by Subject,22.0,3
NCT02023879,Phase III Study To Evaluate Alirocumab in Patients With Hypercholesterolemia Not Treated With a Statin (ODYSSEY CHOICE II),dyslipidemia,Hypercholesterolemia,Sanofi,INDUSTRY,233,3,43,8,2013-12-16,2017-06-30,True,233,178,49,23.6,Adverse Event (20); Other than specified above (16); Poor compliance to protocol (5); Participant moved (3); Consent withdrawn by participant (2); Randomized but not treated (2); Physician Decision (1),Adverse Event,20.0,2
NCT00839527,A Study to Determine the Safety and Efficacy of Albiglutide in Subjects With Type 2 Diabetes,diabetes type 2,"Diabetes Mellitus, Type 2",GlaxoSmithKline,INDUSTRY,685,3,358,9,2009-02,2013-04,True,663,507,443,23.5,Withdrawal by Subject (194); Lost to Follow-up (79); Adverse Event (66); Noncompliance (33); Termination of Study by Sponsor (18); Termination of Site by Sponsor (16); Protocol Violation (12); Physician Decision (9); Site Closed (4); Pregnancy (2); Site Closing and Withdrew Consent (2); Missing Follow-up Status (2); Missing (1); Persistant Elevated HbA1c Results (1); Sponsor Decision on Blinding (1); Informed Consent Recalled by Participant (1); Investigator Closed Study at Site (1); Unable to Complete Follow-up (1),Withdrawal by Subject,194.0,2
NCT01078675,An Study to Evaluate Rosuvastatin in Children and Adolescents With Familial Hypercholesterolaemia,dyslipidemia,Familial Hypercholesterolaemia,AstraZeneca,INDUSTRY,315,1,15,5,2010-02,2013-02,True,315,241,74,23.5,Protocol Violation (56); Withdrawal by Subject (10); Provided in CRF for specific reasons (5); Adverse Event (3),Protocol Violation,56.0,1
NCT00719563,American Ginseng in Treating Patients With Fatigue Caused by Cancer,cardiovascular disease,"Chronic Myeloproliferative Disorders; Fatigue; Leukemia; Lymphoma; Lymphoproliferative Disorder; Multiple Myeloma and Plasma Cell Neoplasm; Myelodysplastic Syndromes; Myelodysplastic/Myeloproliferative Neoplasms; Precancerous Condition; Unspecified Adult Solid Tumor, Protocol Specific",Alliance for Clinical Trials in Oncology,OTHER,364,2,326,1,2008-10,2013-08,True,341,261,80,23.5,Adverse Event (29); Personal reasons (13); Lack of Efficacy (10); Unknown reasons (10); Medical condition changed (8); Lost to Follow-up (8); Noncompliant (2),Adverse Event,29.0,1
NCT04660643,A Study of Tirzepatide (LY3298176) in Participants With Obesity or Overweight for the Maintenance of Weight Loss,diabetes type 2,Obesity; Overweight,Eli Lilly and Company,INDUSTRY,783,3,70,5,2021-03-29,2023-05-18,True,783,600,182,23.4,Withdrawal by Subject (67); Adverse Event (50); Lost to Follow-up (32); Protocol deviation (13); Other - as reported by the investigator (10); Pregnancy (4); Death (3); Physician Decision (1); Covid-19 (1); Perceived excessive weight loss (1),Withdrawal by Subject,67.0,2
NCT00286455,Efficacy and Safety of Alogliptin in Subjects With Type 2 Diabetes,diabetes type 2,Diabetes Mellitus,Takeda,INDUSTRY,329,3,67,18,2006-02,2007-07,True,329,252,77,23.4,Hyperglycemia rescue (42); Withdrawal by Subject (15); Adverse Event (6); Lost to Follow-up (6); Physician Decision (5); Protocol Violation (2); Participant Non-compliance (1),Hyperglycemia rescue,42.0,1
NCT00168324,A Study of the Safety and Efficacy of a New Treatment for Macular Edema Resulting From Retinal Vein Occlusion,cardiovascular disease,Macular Edema; Retinal Vein Occlusion,Allergan,INDUSTRY,599,3,13,13,2004-10-01,2008-10-01,True,599,459,0,23.4,,,,2
NCT00618956,A Study Of Milnacipran In Patients With Fibromyalgia: Effects On 24 Hour Ambulatory Blood Pressure Monitoring,cardiovascular disease,Fibromyalgia,Forest Laboratories,INDUSTRY,321,2,38,1,2007-10,,True,321,246,75,23.4,"Adverse Event (44); Withdrawal by Subject (12); Lost to Follow-up (9); Protocol Violation (4); Lack of Efficacy (3); did not meet criteria, non-compliance (3)",Adverse Event,44.0,1
NCT00961636,A Long-term Study of ERN/LRPT (Extended Release Niacin/Laropiprant [MK0524A]) in Patients With Dyslipidemia (0524A-102),dyslipidemia,Dyslipidemia,Merck Sharp & Dohme LLC,INDUSTRY,1152,3,0,0,2009-10,2011-01,True,1152,882,270,23.4,Adverse Event (102); Flushing Symptoms (78); Withdrawal by Subject (64); Protocol Violation (15); Lost to Follow-up (6); Physician Decision (5),Adverse Event,102.0,1
NCT03860935,Efficacy and Safety of AG10 in Subjects With Transthyretin Amyloid Cardiomyopathy,cardiovascular disease,Amyloidosis; Amyloid Cardiomyopathy; Transthyretin Amyloidosis; Cardiomyopathies; Heart Diseases,"Eidos Therapeutics, a BridgeBio company",INDUSTRY,632,2,104,18,2019-03-19,2023-05-11,True,632,485,147,23.3,Death (126); Withdrawal of Consent (21),Death,126.0,1
NCT00413413,Efficacy/Safety of Valsartan Plus Amlodipine and Valsartan Alone in Patients With Hypertension,cardiovascular disease,Hypertension,Novartis Pharmaceuticals,INDUSTRY,1134,3,19,1,2007-01,2007-11,True,1134,871,263,23.2,Subject no longer requires study drug (151); Withdrawal by Subject (27); Adverse Event (20); Subject withdrew consent (19); Lost to Follow-up (17); Protocol Violation (16); Lack of Efficacy (5); Unsatisfactory therapeutic effect (4); Protocol deviation (4),Subject no longer requires study drug,151.0,2
NCT00622284,Efficacy and Safety of BI 1356 in Combination With Metformin in Patients With Type 2 Diabetes,diabetes type 2,"Diabetes Mellitus, Type 2",Boehringer Ingelheim,INDUSTRY,1560,2,221,16,2008-02,,True,1551,1191,360,23.2,Adverse Event (151); Lack of Efficacy (60); Other reason (not specified) (57); Withdrawal by Subject (51); Lost to Follow-up (24); Protocol Violation (17),Adverse Event,151.0,1
NCT02546323,A phase3 Study Measuring the Effect of Rosuvastatin 20 mg on Carotid Intima-Media Thickness in Chinese Subjects With Subclinical Atherosclerosis,cardiovascular disease,Atherosclerosis,AstraZeneca,INDUSTRY,543,2,24,1,2015-09-17,2019-01-29,True,543,417,126,23.2,Withdrawal by Subject (69); Adverse Event (28); Met Withdrawal Criteria (16); Lost to Follow-up (5); Non-compliance with Study Drug (4); Patient Specific Reasons (3); Eligibility Criteria not Fulfilled (1),Withdrawal by Subject,69.0,1
NCT02648347,Study to Evaluate Vadadustat for the Correction of Anemia in Participants With Non-dialysis-dependent Chronic Kidney Disease,cardiovascular disease,Anemia; Non-Dialysis-Dependent Chronic Kidney Disease,Akebia Therapeutics,INDUSTRY,1751,2,439,20,2015-12,2020-07-31,True,1751,1345,406,23.2,Death (341); Lost to Follow-up (39); Withdrawal by Subject (25); Missing (1),Death,341.0,1
NCT01087502,Safety and Efficacy of Linagliptin in Type-2-diabetes Mellitus Patients With Moderate to Severe Renal Impairment,diabetes type 2,"Diabetes Mellitus, Type 2",Boehringer Ingelheim,INDUSTRY,241,3,52,9,2010-03,,True,241,185,73,23.2,Adverse Event (36); Other reason not described above (12); Withdrawal by Subject (7); Protocol Violation (6); Study site excluded from analysis (6); Lack of Efficacy (4); Lost to Follow-up (2),Adverse Event,36.0,2
NCT00143598,The SOX Trial: Compression Stockings to Prevent the Post-Thrombotic Syndrome,cardiovascular disease,Deep Venous Thrombosis,Sir Mortimer B. Davis - Jewish General Hospital,OTHER,806,2,25,2,2004-06,2012-02,True,806,620,186,23.1,Death (72); Withdrawal by Subject (70); Lost to Follow-up (44),Death,72.0,1
NCT03785405,Open-label Extension Study to Evaluate Long-term Safety of Sacubitril/Valsartan in Pediatric Patients With HF,cardiovascular disease,Heart Failure,Novartis Pharmaceuticals,INDUSTRY,216,1,79,27,2019-05-02,2023-12-29,True,216,166,50,23.1,Adverse Event (17); Physician Decision (13); Death (10); Guardian decision (5); Participant decision (2); Lost to Follow-up (1); Other (1); No treatment was received (1),Adverse Event,17.0,1
NCT01557166,Effect of Liraglutide in Obese Subjects With Moderate or Severe Obstructive Sleep Apnoea: SCALE™ - Sleep Apnoea,obesity,Metabolism and Nutrition Disorder; Obesity; Obstructive Sleep Apnoea,Novo Nordisk A/S,INDUSTRY,359,2,42,2,2012-06-07,2013-06-17,True,359,276,83,23.1,Withdrawn consent (32); Adverse Event (26); Protocol Violation (13); Unclassified (7); Lack of Efficacy (3); Target dose not tolerated (1); Psychiatric disorder (1),Withdrawn consent,32.0,1
NCT01106690,The CANTATA-MP Trial (CANagliflozin Treatment and Trial Analysis - Metformin and Pioglitazone),diabetes type 2,"Diabetes Mellitus, Type 2","Janssen Research & Development, LLC",INDUSTRY,344,3,83,11,2010-06,2012-07,True,342,263,72,23.1,Other (33); Adverse Event (13); Withdrawal by Subject (6); Lost to Follow-up (5); Creatinine or eGFR withdrawal criteria (4); Physician Decision (4); Unable to take rescue therapy (3); Noncompliance with study drug (2); Protocol Violation (1); Lack of efficacy on rescue therapy (1),Other,33.0,2
NCT02963935,Effect and Safety of Liraglutide 3.0 mg as an Adjunct to Intensive Behaviour Therapy for Obesity in a Non-specialist Setting,obesity,Metabolism and Nutrition Disorder; Obesity,Novo Nordisk A/S,INDUSTRY,282,2,10,1,2017-02-06,2018-06-19,True,282,217,65,23.0,Unclassified (35); Adverse Event (18); Lost to Follow-up (7); Protocol Violation (3); Lack of Efficacy (2),Unclassified,35.0,1
NCT02541383,A Study to Evaluate Daratumumab in Transplant Eligible Participants With Previously Untreated Multiple Myeloma,cardiovascular disease,Multiple Myeloma,Intergroupe Francophone du Myelome,NETWORK,1085,4,107,3,2015-09,2023-09-01,True,1085,835,250,23.0,Death (222); Lost to Follow-up (13); Consent withdrawn (13); Sponsor's decision (2),Death,222.0,1
NCT01064414,"An Efficacy, Safety, and Tolerability Study of Canagliflozin in Patients With Type 2 Diabetes Mellitus Who Have Moderate Renal Impairment",diabetes type 2,"Diabetes Mellitus, Type 2; Renal Insufficiency","Janssen Research & Development, LLC",INDUSTRY,272,3,106,18,2010-06,2012-08,True,269,207,57,23.0,Other (21); Adverse Event (15); Withdrawal by Subject (10); Protocol Violation (5); Death (2); Noncompliance with study drug (2); Lost to Follow-up (1); Physician Decision (1),Other,21.0,2
NCT02861534,A Study of Vericiguat in Participants With Heart Failure With Reduced Ejection Fraction (HFrEF) (MK-1242-001),cardiovascular disease,Heart Failure; Chronic Heart Failure With Reduced Ejection Fraction,Merck Sharp & Dohme LLC,INDUSTRY,5050,2,0,0,2016-09-20,2019-09-02,True,5050,3889,1161,23.0,Death (1093); Withdrawal by Subject (33); Lost to Follow-up (28); Site Terminated by Sponsor (7),Death,1093.0,1
NCT04184622,A Study of Tirzepatide (LY3298176) in Participants With Obesity or Overweight,diabetes type 2,Overweight; Obesity,Eli Lilly and Company,INDUSTRY,2539,4,118,10,2019-12-04,2024-07-06,True,2539,1961,578,22.8,Withdrawal by Subject (243); Lost to Follow-up (131); Other - as reported by the investigator (81); Adverse Event (67); Pregnancy (23); Death (13); Missing Weight at Week 176 (9); Physician Decision (7); Protocol deviation (2); Site closed (2),Withdrawal by Subject,243.0,3
NCT01370616,Ertapenem Sodium (MK-0826) Versus Piperacillin/Tazobactam Sodium for the Treatment of Diabetic Foot Infections in Chinese Adults (MK-0826-061),cardiovascular disease,Infection; Diabetic Foot,Merck Sharp & Dohme LLC,INDUSTRY,565,2,0,0,2011-09-02,2013-12-18,True,565,436,129,22.8,Withdrawal by Subject (68); Adverse Event (27); Physician Decision (12); Lack of Efficacy (8); Technical Problems (8); Lost to Follow-up (3); Death (1); Progressive Disease (1); Recovery (1),Withdrawal by Subject,68.0,1
NCT01964326,Actual Use Trial of Atorvastatin Calcium 10 mg,dyslipidemia,Hypercholesterolemia,Pfizer's Upjohn has merged with Mylan to form Viatris Inc.,INDUSTRY,1311,1,37,1,2013-10,2014-12,True,1311,1014,297,22.7,Lost to Follow-up (88); Withdrawal by Subject (87); Physician Decision (55); Adverse Event (48); Other (9); Protocol Violation (4); Death (2); Pregnancy (1); No Longer Meets Eligibility Criteria (1); Investigator Discretion (1); Did not meet eligibility criteria (1),Lost to Follow-up,88.0,1
NCT00849017,Safety and Efficacy Study of Albiglutide in Type 2 Diabetes,diabetes type 2,"Diabetes Mellitus, Type 2",GlaxoSmithKline,INDUSTRY,309,3,262,3,2009-01,2013-02,True,301,233,186,22.6,Lost to Follow-up (66); Withdrawal by Subject (52); Adverse Event (27); Noncompliance (13); Termination of Study/ Site by GSK (10); Did Not Enter Follow-up Period (6); Physician Decision (5); Pregnancy (2); Increased Calcitonin (1); Physician Discontinued-Thrombocytopenia (1); Participant Moved to Africa (1); Participant Decided to Move Out of State (1); Participant Relocating to Africa (1),Lost to Follow-up,66.0,2
NCT01167881,Efficacy and Safety of Empagliflozin (BI 10773) With Metformin in Patients With Type 2 Diabetes,diabetes type 2,"Diabetes Mellitus, Type 2",Boehringer Ingelheim,INDUSTRY,1549,2,182,23,2010-08,2015-08,True,1549,1199,350,22.6,"Adverse Event (98); Other not defined above (86); Patient refusal to cont., not due to AE (85); Lost to Follow-up (39); Non compliant with protocol (27); Lack of Efficacy (11); Not treated (4)",Adverse Event,98.0,1
NCT01623115,Efficacy and Safety of Alirocumab (SAR236553/REGN727) Versus Placebo on Top of Lipid-Modifying Therapy in Patients With Heterozygous Familial Hypercholesterolemia Not Adequately Controlled With Their Lipid-Modifying Therapy,dyslipidemia,Hypercholesterolemia,Sanofi,INDUSTRY,486,2,91,14,2012-07,2014-12,True,486,376,110,22.6,Last visit outside protocol visit window (40); Adverse Event (23); Poor compliance to protocol (14); Consent withdrawn by participant (8); Site closure (8); Participants moved (6); Death (4); Other than specified above (3); Related to study drug administration (2); Randomized but not treated (1); Physician Decision (1),Last visit outside protocol visit window,40.0,1
NCT04157751,A Study to Test the Effect of Empagliflozin in Patients Who Are in Hospital for Acute Heart Failure,cardiovascular disease,Heart Failure,Boehringer Ingelheim,INDUSTRY,530,2,118,15,2020-05-18,2021-06-02,True,530,410,120,22.6,Adverse Event (57); Withdrawal by Subject (29); Other reason not stated above (20); Lost to Follow-up (8); Not treated (6),Adverse Event,57.0,1
NCT00433966,Harmonizing Outcomes With Revascularization and Stents in Acute Myocardial Infarction,cardiovascular disease,Myocardial Infarction,"Cardiovascular Research Foundation, New York",OTHER,3602,2,1,1,2005-03,2010-11,True,3602,2790,556,22.5,Lost to Follow-up (360); Withdrawal by Subject (139); Not true myocardial infarction (57),Lost to Follow-up,360.0,2
NCT00484198,Study of Rivoglitazone in Type 2 Diabetes Mellitus,diabetes type 2,Type 2 Diabetes Mellitus,Daiichi Sankyo,INDUSTRY,1912,4,183,18,2007-04-23,2009-02-12,True,1912,1482,430,22.5,Participant Withdrew Consent (139); Hyperglycemia Meeting Discontinuation Criteria (100); Adverse Event (77); Other (76); Therapeutic failure/ lack of efficacy (19); Protocol Violation (19),Participant Withdrew Consent,139.0,1
NCT01499095,Comparison of a New Formulation of Insulin Glargine With Lantus in Patients With Type 2 Diabetes on Basal Insulin With Oral Antidiabetic Therapy,diabetes type 2,Type 2 Diabetes Mellitus,Sanofi,INDUSTRY,811,2,213,13,2011-12,2013-11,True,811,629,182,22.4,Received Rescue Therapy (72); Diverse Reasons (47); Adverse Event (19); Protocol Violation (13); Lost to Follow-up (10); Insulin Dropped Below Authorized Dose (5); Hypoglycemia (4); Lack of Efficacy (3); Diagnosed With Type 1 Diabetes Mellitus (3); Randomized But Not Treated (2); Change in Injection Schedule (2); Perceived Lack of Efficacy (2),Received Rescue Therapy,72.0,1
NCT04509674,EMPACT-MI: A Study to Test Whether Empagliflozin Can Lower the Risk of Heart Failure and Death in People Who Had a Heart Attack (Myocardial Infarction),cardiovascular disease,Myocardial Infarction,Boehringer Ingelheim,INDUSTRY,6522,2,439,22,2020-12-16,2023-11-05,True,6522,5063,1459,22.4,"Patient refusal to continue, not due to adverse event (870); Adverse event, non-fatal event (225); Other reason than listed (201); Lost to Follow-up (70); Not treated (59); Protocol Violation (19); Adverse event, serious fatal event (15)","Patient refusal to continue, not due to adverse event",870.0,1
NCT01023581,Efficacy and Safety of Alogliptin Plus Metformin in Patients With Type 2 Diabetes,diabetes type 2,"Diabetes Mellitus, Type 2",Takeda,INDUSTRY,784,7,201,13,2009-11,2011-06,True,784,609,175,22.3,Withdrawal by Subject (66); Adverse Event (36); Lost to Follow-up (30); Lack of Efficacy (24); Physician Decision (8); Major protocol deviation (5); Pregnancy (3); Other (3),Withdrawal by Subject,66.0,1
NCT02427802,Study of a Topical Gentamicin-Collagen Sponge Along With Systemic Antibiotic in Infected Diabetic Foot Ulcers,cardiovascular disease,"Foot Ulcer, Diabetic; Infection",Innocoll,INDUSTRY,612,3,86,1,2015-05,2016-10,True,612,476,136,22.2,protocol specific treatment unrelated (40); Lost to Follow-up (29); Withdrawal by Subject (26); Adverse Event (21); Physician Decision (10); Death (5); Protocol Violation (5),protocol specific treatment unrelated,40.0,1
